{
  "$schema": "https://json-schema.org/draft/2020-12/schema",
  "title": "Building",
  "description": "A building blueprint defined as a 2D array of tile ids",
  "type": "object",
  "additionalProperties": false,
  "required": ["id", "tiles"],
  "properties": {
    "id": {
      "type": "string",
      "description": "Namespaced building id (e.g., 'core:small_house')",
      "pattern": "^[a-z0-9][a-z0-9_-]*:[a-z0-9][a-z0-9_-]*$"
    },
    "tiles": {
      "type": "array",
      "description": "2D array of tile ids forming the building blueprint",
      "items": {
        "type": "array",
        "items": {
          "type": "string"
        }
      }
    },
    "name": {
      "type": "string",
      "description": "Display name for this building (optional, used by test rendering)"
    },
    "type": {
      "type": "string",
      "description": "Type of building (optional, used by test rendering)"
    },
    "width": {
      "type": "integer",
      "description": "Width of the building blueprint (optional, used by test rendering)"
    },
    "height": {
      "type": "integer",
      "description": "Height of the building blueprint (optional, used by test rendering)"
    },
    "objects": {
      "type": "array",
      "description": "World objects (chests, doors) placed on blueprint tiles when the building is placed",
      "items": {
        "type": "object",
        "additionalProperties": false,
        "required": ["id", "x", "y"],
        "properties": {
          "id": {
            "type": "string",
            "description": "Id of an object defined in a mod's objects/ folder (e.g., 'core:wooden_door')"
          },
          "x": {
            "type": "integer",
            "description": "Column within the blueprint, 0 = leftmost"
          },
          "y": {
            "type": "integer",
            "description": "Row within the blueprint, 0 = top"
          }
        }
      }
    },
    "overrides": {
      "type": "string",
      "description": "If present, this building overrides another building with the same id"
    }
  }
}
